essay_id,grade,essay_topic,essay_text,dyslexic_flag,richness_5,organization_6,technical_3,total_14
G7_001,7,මත් උවදුර පිටු දකිමු,"මත්ද්‍රව්‍ය ලෙස හඳුන්වන්නේ මිනිස් මනස දුර්වලතාවයකට භාජනය කළ හැකි ඕනෑම දෙයකට ය. මත්පැන්, මත්කුඩු, මල්පෙති, මත් දුම් ආදීය මත්ද්‍රව්‍ය සඳහා නිදසුන් වේ.
මත්ද්‍රව්‍ය වලින් සිදු කරන්නේ සැබෑ ලෝකය හා මනඃකල්පිත ලෝකය අතර තාවකාලික සම්බන්ධතාවක් ගොඩ නැංවීමයි. මත්පැන් පානය කළ විට ශරීරයෙන් ජීවත් වෙන්නේ සැබෑ ලෝකයේ වුවත් ඔහු සිය මනසින් ඉතාම සුන්දර ලෝකයක් මවාගෙන එහි ජීවත් වෙයි. මෙය සතුටක් ලෙස සලකන ඔහු ටිකින් ටික ඊට ඇබ්බැහි වෙයි. වර්තමාන සමාජයේ තරුණ පිරිස් අතර ක්‍රම ක්‍රමයෙන් පැතිර යන උවදුරක් ලෙස මෙය සැලකිය හැකිය.
මත්ද්‍රව්‍ය භාවිතය හේතුවෙන් මුලින් ම පිරිහෙන්නේ තමා ම ය. පරාභව සූත්‍රයට අනුව “සුරා ලොල් බව” පිරිහීමේ දොරටුවකි. මත්ද්‍රව්‍ය නිසා මනුෂ්‍යයා සෞඛ්‍ය අනින්ද ආර්ථික අතින් ද පිරිහී යයි. ඔහුගේ පවුලේ අසමගිය ඇති වේ. යහපත් මිතුරන් නැතිවී පාප මිත්‍රයන්ගේ ඇසුරට පත්වේ.
රටේ අනාගතය භාර ගැනීමට සිටින තරුණ තරුණියන් මනසින් ද සිරුරෙන් ද ශක්තිමත් විය යුතුය. මත් උවදුර හේතුවෙන් රටේ සමාජ සංවර්ධනය සහ ආර්ථික සංවර්ධනය අඩාල වේ. රට ජාත්‍යන්තර තලය දක්වා ඔසවා තැබීමට අවශ්‍ය ශක්තිය තරුණයන් තුළින් ඈත් කර දැමීමට මත්ද්‍රව්‍ය සමත් වී ඇත.
UR MASH
onnessee මෙම ගැටලුවෙන් රට ජාතිය බේරා ගැනීමට නම් පවුල පාසල ආගමික ස්ථානය සහ රජය ඒකාබද්ධව කටයුතු කළ යුතුය. තරුණ තරුණියන් රැකබලාගැනීම පවුලක යුතුකමකි. මතට DY ලොල් නොවන සේ නිසි අධ්‍යාපනයක් ලබාදීම පාසලේ වගකීමකි. /
පින්පව් පිළිබඳ ඉගැන්වීම ආගමික ස්ථානයේ යුතුකමකි. මත්ද්‍රව්‍ය
",FALSE,4,4,1,9
G7_002,7,කඳුකර පරිසරයේ සුන්දරත්වය,"ශ්‍රී ලංකාව නම් මනරම් දිවයිනේ මැද පිහිටා ඇත්තේ සුන්දර කඳු පන්ති රාශියකි. දිවා කාලයේ පවා සීතල මීදුමෙන් වැසී යන පිදුරුතලාගල කන්ද, කදු මුදුන් නමයකින් සමන්විත නමුනුකුල කන්ද, නකල්ස් කඳු වැටිය හා කිරිගල්පොත්ත කන්ද වැනි යෝධ කඳු ඒ සඳහා උදාහරණයි.
ශ්‍රී ලංකාව සෞම්‍ය දේශගුණයක් ඇති රටකි. වර්ෂාව අඩුත් නැති වැඩිත් නැති වාසනාවන්ත රටකි. රට සරුසාර කරන ජල දහරාව උපදින්නේ රට මැද ඇති සුන්දර උස් කඳු මුදුන්වලයි. මහවැලි, කැලණී, කළු, වලවේ යන ගංගා එසේ උපදින ගංගාවලට උදාහරණයි. මේ ජලදහරා කඳු නැමැති කාන්තාවගේ ගෙලෙහි බැඳපු මුතු මාලයක් බඳු ය. කඳු මුදුන්වල සිට සුදු පාට පෙණ නංවමින් කඩා හැලෙන මේ දියදහරා මනස්කාන්ත ය. එමෙන් ම කඳුකර පරිසරය ඉතා සීතල ය. විටෙක මීදුමෙන් වැසී යයි. ස්වභාව සෞන්දර්යට ආදරය කරන අය නම් මේ කඳු තරණය කර සීතල දිය ස්නානය කර ගත සිත පුබුදුවා ගනිනි.
ශ්‍රී ලංකාවේ කඳුකර පරිසරයේ සුන්දරත්වය විදෙස් රටවල ජනතාව අතර පවා ප්‍රසිද්ධ ය. එබැවින් ලෝකයේ බොහෝ රටවලින් සංචාරකයෝ ශ්‍රී ලංකාවට පැමිණෙති. උඩරට දුම්රියෙන් නුවරඑළිය, බදුල්ල, මාතලේ ආදී කඳුකරයට යන ඔවුහු කදුකර පරිසරයේ සුන්දරත්වයට වශී වී දින සති ගණන් එහි ම ගත කරති.
කඳු සුන්දර වන්නේ ඒ මත පිහිටි තුරුලතාවන් සහ ජල ධාරාවන් නිසා ය. කඳුකර පරිසරයේ සුන්දරත්වය ඉදිරි පරම්පරාවටත් දායාද කිරීමට නම් ගහකොළ සහ ජල දහරා සුරුකිය යුතුය. එබැවින් කඳුකර පරිසරයකට ගොස් මේ සුන්දරත්වය විඳීමට හා ඒවාට ආදරය කිරීමට අපි පුරුදු පුහුණූ වෙමු.
",FALSE,5,5,2,12
G7_003,7,දෙමවුපියන්ගේ අගය,"“ලෝකය රදා පවතින්නේ හිරුගේ රශ්මියෙන් සහ මවගේ කිරිවලිනි” යැයි මැක්සිම් ගෝර්කි නිර්වචනයක් ඉදිරිපත් කර ඇත. ඒ තුළින් අපව බිහිකළ අපේ ආදරණීය මවගේ වටිනාකම මතු වේ. එසේ ම “පිය සෙනෙහසට කවි ගී ලියවුණා මදී...” යන ගීයෙන් ඇගයෙන්නේ අපගේ ආදරණීය පියාණන් ය. සඳහිරු වන් මේ දෙදෙනා අපගේ දෙමාපියන් වන්නේ ය.
මේ ලෝකයට අපව බිහි කරන්නේ මව ය. අපි සියල්ලෝ ම මවු කුස තුළ දස මසක් වැඩුනෙමු. බිහි වූ දා සිට මව අපව අහරින් පෝෂණය කළා ය. ඈ අපගේ පළමු වෛද්‍යවරිය යි; පළමු මිහිරි තනු මුමුණන්නිය යි; පළමු ගුරුතුමිය යි; අප දුටු සුන්දර ම කාන්තාව යි. ඒ මව අප උස් මහත් වන විට අපට සමාජය හුරු කළා ය. ඈ අපට යහපත් ගුණධර්ම හුරු කර මිනිසත් කම හුරු කළා ය. මව පිළිබඳ ඇගයීමට අකුරු, වචන හා වැකි ප්‍රමාණවත් නැත. මවගේ අගය සීමාවක් නැති සාගරය වැනි ය.
අපගේ පියා මේ ලොව වසන ශක්තිමත් ම මිනිසා ය. අපට හිසට සෙවනක් ගොඩනැගීමට, කවා පොවා උස් මහත් කිරීමට, සෙල්ලම් බඩු අරන් දීමට, ඇදුම් අරන් දීමට, ඉගැන්වීමට අපගේ පියා මහන්සි වී මුදල් ඉපයූ බව අපි පසු ව දැන ගත්තෙමු. එතරම් ආදරයක් නොපෙන්නුව ද අපව ආරක්ෂා කර නිවැරදි මඟ යෑමට පියාගේ සෘජු හා සැර ගතිගුණය ආශිර්වාදයක් විය. ඔහු සැම දා අපට ශක්තියක් වන බව
-TUTOR
වා නොහැදිළිය. පියාගේ අගය සීමාවක් නැති අහස වැනි ය.
තව කෙටි කාලයකින් අපි තරුණ වියට පා තබමු. එකළට අපගේ ඇස් දෙක වන් දෙමවුපියෝ මහලු වියට පා තබන්නෝ ය. එදිනට අපි ඔවුන් ආදරයෙන් රකිමු; පෝෂණය කරමු; සළකමු. දෙමවුපියන්ගේ අගය වටහාගත්
ජීවිතය සතුටින් ගත කිරීමට අවශ්‍ය සෑම කටයුත්තක් ම කරමු.
වන්ගේ ඉදිරි
",FALSE,5,5,2,12
G7_004,7,"ශ්‍රීමත් ආතර් සී ක්ලාක්
","දියයට කිමිදීම විනෝදාංශයක් කරගත් දක්ෂ කිමිදුම්කරුවෙක් එංගලන්තයේ ජීවත් විය. ඔහු දියයට කිමිදීම සඳහා ඔස්ට්‍රෙලියාවේ මහා බාධක පරය වෙත “හිමාලයා” නම් නැවෙන් ගමන් ගත්තේ ය. ඒ අතර අහම්බෙන් ශ්‍රී ලංකාවට පැමිණි ඔහු ශ්‍රී ලංකා මාතාවගේ සුන්දරත්වයට වශී විය. එබැවින් තමන් උපන් එංගලන්තය අතහැර 1956දී ශ්‍රී ලංකාවේ පදිංචියට පැමිණියේ ය. ඉන්පසු 1975 දී ශ්‍රී ලංකාවේ ගෞරවනීය පුරවැසි භාවය ලබා 2008 මාර්තු 19 දින මිය යන තෙක් ම ශ්‍රී ලංකාවේ ජීවත් වූ ඔහු ශ්‍රීමත් ආතර් සී ක්ලාක් වන්නේය.
ශ්‍රීමත් ආතර් සී ක්ලාක් මහතා හඳුන්වන්නේ චන්ද්‍රිකා තාක්ෂණයේ පියා ලෙස ය. ඔහු ශ්‍රී ලංකාවට පැමිණීමටත් පෙර 1945 වසරේදී “වයර්ලස් වර්ල්ඩ්” සඟරාව මඟින් “භූ ස්ථාවර චන්ද්‍රිකා” සංකල්පය ලෝකයට හඳුන්වා දුන්නේ ය. වර්තමානයේ මුළු ලෝකය ම තොරතුරු සන්නිවේදනය නිසා විශ්ව ග්‍රාමයක් බවට පත්වී ඇත්තේ ඔහුගේ ආරම්භය නිසා ය.
ඔහු විශ්වය පිළිබඳ අභිරහස් හෙළිකරන ග්‍රන්ථකරණයේ යෙදුණේ ය. ඔහු ලුප්පෝල, රෙස්කියු පාටි, ද සෙන්ටිනල්, 2001, 2010, නම් පොත් පළ කළේය. එසේම ඔහු ලංකාවේදී ද “ෆවුන්ටන්ස් ඔෆ් පැරඩයිස්” නම් කෘතිය පළ කළේය.
ශ්‍රීමත් ආතර් සී ක්ලාක් මහතා ලොවට කළ සේවය අගයා සම්මානයෙන් පිදුම් ලැබුවේ ය. 1982දී යුනෙස්කෝව විසින් “කාලිංග” සම්මානයන්, 1998දී බ්‍රිතාන්‍ය මහ රුජන විසින් පිරිනැමූ “නයිට්” පදවියත් ඉන් ප්‍රධාන සම්මානයි. එසේම අප ඉහළම පුරවැසි සම්මානය වන “ශ්‍රී ලංකා අභිමාන්‍ය” සම්මානය ඔහුට 2005 වසරේදී පිරිනැමුවේ ය.
ඔහු විනෝදයට කළේ දැනුම සොයා යාමයි. ඔහුගේ චින්තනය සීමාවකින් තොරව මුළු විශ්වයේ කෙලවර තෙක්ම පැතිරවීය. කිත් පැසසුම් ලැබුවේය. සාර්ථක ජීවිතයක් ගත කළේය. එබැවින් ආතර් ශ්‍රී ක්ලාක් මහතා අපට ආදර්ශවත් චරිතයකි.
",FALSE,5,5,2,12
G7_005,7,හික්කඩුවේ ශ්‍රී සුමංගල හිමි,"අතීතයේ ශ්‍රී ලංකාවේ බ්‍රිතාන්‍ය අධිරාජ්‍යවාදීන්ට යටත් වූ අඳුරු වහල් සමයක් විය. ඒ කාලයේ පරිහානියට පත්වෙමින් තිබුණු ආගමික හා සංස්කෘතික අංශයට නවමු ප්‍රබෝධයක් එක්කළ, දැය ම එකලු කළ මහා පහන් ටැඹ ලෙස විරුදාවලිය ලබන්නේ හික්කඩුවේ ශ්‍රී සුමංගල නා හිමි වන සේක.
ගාල්ල දිස්ත්‍රික්කයේ හික්කඩුව හෙට්ටිගොඩ ග්‍රාමය උන්වහන්සේගේ උපත සිදු වූ පින් බිමයි. ඒ 1827 වසරේ දුරුතු මස 20 වන දින විය. පසුව උන්වහන්සේ වයස අවුරුදු 13 දී හික්කඩුවේ තොටගමුවේ රජ මහා විහාරයේ දී පැවිදි භාවයට පත් වූ සේක. ශ්‍රී සුමංගල හිමි ශාස්ත්‍රිය අධ්‍යාපනයෙන් පරතෙරට පත් වූහ; සිංහල පමණක් නොව පාලි, සංස්කෘත හා ඉංග්‍රීසි පවා දැන, උගත්කමින් අද්විතීය වූහ. එබැවින් ශ්‍රී සුමංගල හිමි “ත්‍රිපිටක වාගීශ්වරාචාර්ය” යන නම්බු නාමයෙන් ද හඳුන්වන ලදහ. උන්වහන්සේගේ මැදිහත්වීමෙන් ආරම්භ වූ පංච මහා වාද වන බද්දේගම වාදය, උදම්විට වාදය, ගම්පොළ වාදය, පානදුරා වාදය, ඌරුගොඩවත්තේ වාදය ආදිය තුළින් උන්වහන්සේගේ පාණ්ඩිත්‍යය ලොව පුරා ප්‍රකට විය.
උන්වහන්සේ කළ සේවාවන් අතර සිංහල භාෂාවේ දියුනුවට කළ මෙහෙය අද්විතීය. කාව්‍යශේඛර සන්නසය, සිදත් සඟරා සන්නසය සහ පාලි මහාවංසය සිංහලට පරිවර්තනය
උන්වහන්සේගේ ය. එසේම උන්වහන්සේගේ ශාස්ත්‍රිය රාවයට ලොව පුරා සිටින ධාර්මික නැණවත් පුද්ගලයෝ ලක් මව වෙත ඇදී ආහ. ඒ අතර කර්නල් ඕල්කට්තුමා විය. ඔහු සුමංගල නා හිමියන් වෙත පැමිණ බුදුදහම ඉගෙනගෙන ගත්තේ ය. පසුව ලාංකික සමාජයට ඉමහත් සේවාවක් සිදු කරන ලදී. උන්වහන්සේ මෙවැනි දෙස් විදෙස් උගතුන් සමඟ එක්වී බුදුදහම ලොව පුරා ප්‍රචලිත කිරීමට මුල් වූහ.
සිංහල භාෂාව සහ බෞද්ධ දර්ශනය ඇතුළු මුළුමහත් හෙළ සංස්කෘතියේ ම පෝෂණයට රන් ආකරයක් බඳු වූ හික්කඩුවේ ශ්‍රී සුමංගල හිමි 1911 වසරේ අප්‍රේල් 29 දින අපවත් වූ සේක.
",FALSE,5,5,2,12
G7_006,7,වැඩිහිටියන් රැක බලා ගනිමු,"වැඩිහිටියන් යනු අපට වඩා බොහෝ කාලයකට පෙර ඉපදී, අපට වඩා කාලයක් මේ ලෝකයේ ජීවත් වූ, බොහෝ අත්දැකීම් හා දැනුම් සම්භාරයක් සහිත වැදගත් පුද්ගලයෝ වෙති. බොහෝ වැඩිහිටියෝ තමාගේ තරුණ කාලයේ සිට සමාජයට යුතුකම් නොපිරිහෙළා ඉටු කළ අය වෙති.
සමාජය වැඩිහිටියන්ව ජ්‍යෙෂ්ඨ පුරවැසියන් ලෙස හඳුන්වයි. වැඩිහිටියන්ගෙන් සමාජයට සිදුවන සේවාව කියා නිම කළ නොහැක. ඔවුහු අපව ආරක්ෂා කරගැනිම සදහා නිරන්තරයෙන් ම සැදී පැහැදී සිටිති. පාරම්පරික දැනුම, සිරිත් විරිත්, සම්ප්‍රදායන් ආදිය ඊළඟ පරම්පරාව වෙත දායාද කරන්නේ වැඩිහිටියෝ ය. වැඩිහිටියන් විසින් අප හට යම් උපදෙසක් දෙනු ලබන්නේ ද, එම උපදෙස තුළ අප ජීවිතය යහමග පවත්වාගෙන යාමට අවශ්‍ය සියලු ගුණධර්ම පිරී තිබේ. මේ ආදි වූ බොහෝ කරුණුවලින් වැඩිහිටියන්ගේ අගය අපට තහවුරු කළ හැකිය.
වර්තමාන පුවත්පත්, ගුවන්විදුලි, රූපවාහිනී මාධ්‍යවලින් වැඩිහිටියන්ගේ ගෞරවය විනාශ වන ආකාර පුවත් හමුවේ. ඒ ඇතැම් පුද්ගලයන් තම වැඩිහිටියන් වෙනුවෙන් කළ යුතු යුතුකම් කඩකිරීමේ ඛේදනීය අවස්ථාවන් ය. පොදුවේ ගත් විට වර්තමාන සමාජය වැඩිහිටියන්ට සලකන ආකාරය බොහෝ අශෝභනය.
වැඩිහිටියන් රැකබලා ගැනීමට නම් ඔවුන් සමඟ සාමකාමීව ජීවත් විය යුතුය. ඔවුන් සමඟ වාද විවාදවලට පැටලීම සුදුසු නොවේ. වැඩිහිටියන්ගේ යම් වරදක් දුටුවොත් ඔහු හෝ ඇය සමග වාදයට නොගොස් ඉවසීමෙන් කටයුතු කළ යුතුය. එසේම වැඩිහිටියන්ට ලෙඩක් දුකක් සෑදුණු විට ඔහු හෝ ඇය අසල සිට අවශ්‍ය ඖෂධ ලබාදී හොඳින් සැලකිය යුතුය.
රජය යටතේ වැඩිහිටියන් රැක බලා ගැනීම පිළිබඳ බොහෝ ක්‍රියාමාර්ග ගත හැකිය. වැඩිහිටියන් රැකබලා ගැනීම පිළිබඳ නව නීති හඳුන්වා දීම, වැඩිහිටියන් රැක බලා ගැනීම පිළිබඳ ජනතාව දැනුවත් කිරීම, ඒ අතර ඇති වැදගත් ක්‍රියාමාර්ග වේ.
කෙලෙහිගුණ දත් ධර්මිෂ්ඨ සමාජයක යුතුකම වන්නේ තම ජ්‍යෙෂ්ඨ පුරවැසියන් රැකබලාගෙන ඔවුන්ට හිමි ගෞරවය ලබා දීමයි. එම ජාතික යුතුකම කිරීමට අපි ඇප කැප වෙමු.
",FALSE,5,5,2,12
