essay_id,grade,essay_topic,essay_text,dyslexic_flag,richness_5,organization_6,technical_3,total_14
G5_011,5,මගේ ආදරණීය පවුල,"මගේ ආදරණීය පවුල කියන්නේ මට ආදරය, ආරක්ෂාව සහ සතුට ලබා දෙන විශේෂ කට්ටලයකි. මගේ දෙමාපියන්, සහෝදර සහෝදරියන් මට ආදරය සහ සහය ලබා දෙන අතර, මම ඔවුන්ට ආදරයෙන් හැසිරෙමි. අපි එක්ව කතා කරමින්, ආහාර පිසීමේ සහ නිවසේ කටයුතු වලට සහභාගී වනවා. පවුලේ සෙල්ලම් සහ විනෝද ක්‍රියාකාරකම් මට සතුට සහ ආඩම්බරය ලබා දේ. මගේ පවුල මට නිදහස, ආරක්ෂාව සහ ආශිර්වාද ලබා දෙන නිසා මම සතුටින් ජීවත් වෙමි. පවුලේ අයගේ ආදරය සහ උපදෙස් මගේ ජීවිතයේ වැදගත් පාඩම් ඉගැන්වීමේදී මට උපකාර කරනවා. අපි එක්ව උදේ සහ සවස කාලය ගත කිරීම, ගමනක් යාම, ක්‍රීඩා කිරීම සහ කතාබහ කිරීම මගේ සමාජීය හැකියාවන් වර්ධනය කරනවා. මගේ ආදරණීය පවුල මට ජීවිතයේ සතුට, ආරක්ෂාව සහ සමාජීය සම්බන්ධතා වර්ධනය කිරීමේ වැදගත්කම පිළිබඳව මනෝබල ලබා දෙයි. මම පවුලේ සැමට ආදරය සහ ගෞරවයෙන් හැසිරෙමින්, ඔවුන්ගේ සතුට, ආරක්ෂාව සහ ආදරය රැක ගැනීමට උත්සාහ කරනවා. මගේ ආදරණීය පවුල මගේ ජීවිතයට අගය සහ ආශිර්වාද ලබා දෙන නිසා, එය මගේ සතුට, ආරක්ෂාව සහ ජීවිතයේ ආරම්භක ආශ්වාද සඳහා වැදගත් ස්ථානයක් බවට පත්ව ඇත.",FALSE,5,6,2,13
G6_001,6,හීනයක් ,"ඊළඟ ඉසව් ....... ශබ්ද විකාශන යන්ත්‍රයේ හඬ මට අපැහැදිලිය. යන්න දරුවා ඉක්මනට ආරම්භක ස්ථානයට යන්න. ගුරුතුමිය මට කීවාය. මම කඩිසර ගමනින් තරඟ ආරම්භ ක
ස්ථානයට ගියෙමි.
ආරම්භක නිලධාරී අපට මං තීරු නම් කළේය. මම තෙවෙනි මං තීරුවේ ආරම්භක ඉර පිටු පසට ගියෙමි. තවත් පාසල් කිහිපයක තරගකරුවෝද ආරම්භක රේඛාව පසු පස සිටිති.
තරඟය ආරම්භ කිරීමට පෙර තරඟ කොන්දේසි කියනවා යාන්තමින් මට ඇසිණි. ඒ සමගම සැරසෙන් විධානය ඇසුණි. මම ආරම්භක ඉර පිටුපසට ගොස් තරඟය සඳහා සූදානම් වුණෙමි. එල්ල වෙන් විධානය සමඟ ඇසුණු වෙඩි හඬට මම ඉදිරියට පැන් දුවන්නට වුණෙමි.
මා අසලින්ම කවුදෝ එනවා දැන් මා පරාද වෙයි මම දෙපයට වාරු ගෙන ඉගිලුණෙමි. මා අසලින්ම ආ නරඟ කරුවා මගේ ඇඟේ හැප්පෙනවා සේ දැනුණි. එවිටත් මම ජයග්රාහී ඉලක්කය පසු කර තිබුණි. මට දැනුණේ මා විසි වී ගොස් බිම වැටෙන බවයි.
අයියෝ අම්මේ........... මම කෑ ගැසුවද හඬ පිට නොවුණි. එහෙත් අම්මා මගේ හිස අතගානවා දැනී මම අවදි වුණෙමි.
ඇයි දුව බය වුණාද? දුව හීනයක් දැකලා අම්මා මා තුරුලු කර ගත්තාය
",FALSE,5,5,2,12
G6_002,6,සීගිරිය,"ඈතදීම සතුරන් දැක ගැනීමට කාශ්‍යප රජු තැනු බල කොටුවයි. මේ එහි තිබෙන චිත්‍ර අප රට සිටි නිර්මාණ කරුවන්ගේ දක්ශකම ලොවම කියා පායි. චිත්‍ර නරඹා වශී වූවන් කැටපත් පවුරේ ලියු කුරුටු ගී රැසකි. එය වටා ඇති දිය හා නල මාර්ග අද
ඉන්ජිනේරුවන් පවා විස්මයට පත් කරවයි. ඒ පව්ව මුදුනෙ වු රජ මාලිගාවේ නටඹුන් අද ද දැක ගත හැක.
සීගිරිය නැරඹීමට එන දෙසි විදෙස් සන්චාරකයන්ගේන් නිතරම මෙය අතුරු සිදුරු නැතිව පිරියයි.
",FALSE,4,4,2,10
G6_003,6,අලුත් පාරක්,"දිනක් අපේ ගමට මිනින්දෝරු කණ්ඩායමක් පැමිණ බිම් මැන කූඤ්ඤ ගසා බිම සලකුණු කළහ. ගම් වැසියෝ ගම හරහා අලුත් පාරක් ඉදි වන බව පැවසුහ. සමහරු පාර කැපෙනවාට කැමති වූ අතර සමහරු විරෝධතාවයද පෑහ.
බර වාහන පෙළක් ගමට පැමිණියේය. ඩෝසර, ගල් රෝල, ආදී නවීන යන්ත්‍ර සූත්‍ර රැසක් සමග වැඩ කරන මිනිස්සු ගමට පැමිණියහ. ගමේ බොහෝ දෙනෙක් ද පාරේ රැකියාවට ගියහ.
කෙමෙන් සති මාස ගණන් ගෙවි ගියේය. අලුත් පාර සදා නිම විය. අලුත් පාර මංතිරු හතරක් පමණ තිබේන ඉතා පුළුල් පාරක් විය. එය දක්ෂිණ අධිවේගී මාර්ගය ලෙස නම් කෙරුණි.
ශ්‍රි ලංකාවේ පළමු අධිවේගී මාර්ගය අපේ ගම හරහා ඉදි විය. එහෙත් ඒ පාර පදිකයින්ට හා යතුරු පැදි, පාපැදි, ත්‍රීරෝද රථවලට තහනම් ය. එම පාරට ඇතුළුවීමට හා ඉන් පිට වීමට ප්‍රවේශ දොරටු පිහිටුවා ඇත. කොළඹ කොට්ටාවෙන් ඇරඹෙන මෙම සුවිශේෂි පාර ගාල්ලෙන් අවසන් වෙයි.
පාරේ ගමන් ගන්නා වාහන වලට පැයට කිලෝමිටර සියයක උපරිම වේගයකින් ගමන් කිරීමට අවසර ඇත. පාර පරිහරණය කිරීම වෙනුවෙන් ගස්තු අය කෙරෙයි.
",FALSE,5,5,3,13
G6_004,6,ගොළුබෙල්ල,"රාත්‍රී කාලයට ගෙවත්තේ පැළ කා දැමීමට එන අමුත්තෙකු පිළිබඳව අපි පරික්ශාවෙන් සිටියෙමු.
ඉර බැස ගොස් කරුවල වැටෙනවාත් සමග මේ අමුත්තා සැඟවී සිටි තැනින් එළියට ආවේ ය.උ හිස මත වු සංවේදී ස්පර්ශක දිගු කොට අවට පරීක්ෂා කරන්නට විය. කරදරයක සේයාවක් නොදුටුවෙන් පැළ තවාන වෙත හෙමින් හෙමින් ලිස්සා යන්නට පටන් ගත්තේය. සාරු මතින් ලිස්සා යන මෙම ගමන ඉතා අසිරු ගමනක් විය.
ගොළුබෙල්ලා පැලැටි ආහාරයට ගන්නා අහිංසකයෙකි. උට ගොවියාගේ සතුරා යන නම පට බැදි තිබේ. ගොළුබෙල්ලගේ පරම සතුරා ඇටිකුකුළාය. දහවල් කාලයේ උණුසුම ගොළුබෙල්ලා විඩා පත් කරයි. එබැවින් උ දහවල් කාලයට සැගවී සිටි. උගට ආපදාවක් පැමිණෙන විට සැගවී සිටිමට බාහිර කටුවක් උගේ ශරීරයේ නිර්මාණය වී තිබේ.
හෙමින් වැඩ කරන විට "" ගොළුබෙලි ගමන "" යයි සමහරු කියති.
",FALSE,5,5,3,13
G6_005,6,නියගය,"සති ගණනවක් එක දිගට තදින් පායන්නට විය. මහ පොළොව වියළි ඉරි තලා ගොසිනි. දිය කඩිති සිඳි ගොසිනි. මහා ගංගා ගලා නොබසි, වාලුකා කාන්තාර සේ පෙනෙයි.
නියගයට අසු වූ ගහ කොළ වියලි ගොස් දර අකුල් බවට පත්ව තිබේ. ගොවි තැන් පාලු වී යාම නිසා මහ ජනතාව අසිරුතාවන්ට මුහුණ දෙති. ඔවුහු පානිය ජලය සොයා ගව් ගණන් දුර ඇවිද යති.
විඩාවට පත් ජනතාව වැසි ඉල්ලා දෙවියන්ට කන්නලව් කරති. පුද පූජා පවත්වති. රජයේ නිලධාරීහු පැමිණ ගමට නියං සහනාධාර බෙදති. වියලි ආහාරයන්ට අමතරව පැතිර යන රෝග වළක්වා ගැනීමට උපදෙස් සපයති.
නියං රකුසා කෝපයට පත්ව කරනු ලබන විනාශාය කවදා නිම වෙයිද ? නිල් අහස කළු වළාකුලින් පිරිණි. විදුලිය කොටා අහස ගුගුරන්නටද විය. විපතට පත් මිනිස්සු සතුටින් අහස දෙස බලා සිටිති. "" හැම දා නියං එක දා වැහි වලාවේ "" නියගය අවසාන කරමින් මහා වැසි පතිත විය.
",FALSE,5,5,3,13
G6_006,6,වෙල් යාය,"මම මහා වෙල් යායක, ගොයම් කරලේ එක් බිජයක් වෙමි. මගේ පිට හම දහයියා' ලෙස ගොවියෝ හඳුන්වති.
මෝල් ගසෙන් ගසා මගේ පිට හම ඇර ගන්නා ගෙවිලියෝ, මා හොදින් නහවා පිරිසිදු කොට සැලියක දමා තබති.
එ හැම වේදනාවක්ම මම මැදිහත් සිතින් විද දරා ගනිමි. තම්බා ගත් මා ඊළගට යන්නේ දීසියක් මතින් කෑම මේසයටය.
මිනිස්සු වෑංජන සමග රස කරමින් මා බුදිති. මිනිසාගේ කුස ගිනි නිවීමට මා උපන් නිසා මම එය කරදරයක් ලෙස නොසැලකමි.
විටක හාල් කියාද තවත් විටක බත් කියාද අමතන මම ඔබේ හිතාදර කුඩා වී ඇටය වෙමි.
",FALSE,5,6,3,14
G6_007,6,මගේ ආදරණීය උයන,"මගේ ආදරණීය උයන කියන්නේ මාට සතුට, සාමය සහ විනෝද ලබා දෙන ස්ථානයකි. එහි වගා කළ පැළ සහ මල් මට සුන්දර දසුනක් ලබා දෙයි. උයනේ පිටත ක්‍රීඩා කිරීමට, ගස් හා මල් නරඹා විනෝද වීමට සහ මිතුරන් සමඟ කාලය ගත කිරීමට මට අවස්ථාව ලැබේ. මම උයනේ පිටත ගොඩනැගිලි සහ ක්‍රීඩා පිටිය පිරිසිදු තබා, ආරක්ෂිතව භාවිත කිරීමට කටයුතු කරනවා. උයනේ වටපිටාව මාගේ ජීවිතයට සතුට, ආරක්ෂාව සහ සාමය ලබා දෙන අතර මම එය ආදරයෙන් රැක ගනිමි. මගේ උයන මට නව දේවල් සොයා බැලීමට, නිර්මාණාත්මක හැකියාවන් වර්ධනය කිරීමට සහ සමාජීය හැකියාවන් වර්ධනය කිරීමට උපකාරී වේ. මම උයනේ ක්‍රීඩා කිරීමේදී මිතුරන් සමඟ එකතු වී සෙල්ලම් කිරීම, කතා කිරීම සහ ගිවිසුම් පිළිපැදීමේ වැදගත් පාඩම් ඉගෙන ගනිමි. උයනේ වටපිටාව පිරිසිදු, ආරක්ෂිත සහ පරිසර හිතකාමීව පවත්වා ගැනීම මගේ වගකීමකි. මගේ ආදරණීය උයන මට සතුට, ආශිර්වාද සහ ජීවිතයේ සාමය ලබා දෙන නිසා මම එය ආදරයෙන් සහ ගෞරවයෙන් හැසිරෙමි. එය මාගේ දිනය සතුටින් පිරවීමට සහ මාගේ ජීවිතයට අගය එක් කිරීමට වැදගත් වේ.",FALSE,5,5,3,13
G6_008,6,මගේ හිතවත් මිතුරන්,"මගේ හිතවත් මිතුරන් කියන්නේ මා සමඟ සෙල්ලම් කරන, කතා කරන සහ දුකේදී මට ආධාර කරන අයයි. මගේ පාසලේ සහ ගමේ මිතුරන් මට විශේෂ ස්ථානයක් දක්වයි. අපි එක්ව ක්‍රීඩා කරනවා, කුඩා ගැටලු විසඳනවා සහ නව දේවල් ඉගෙනීමට උත්සාහ කරනවා. මිතුරන් සමඟ කාලය ගත කිරීම මට සතුට සහ ආඩම්බරය ලබා දෙයි. ඔවුන් මට විවිධ අභියෝග ජය ගැනීමට සහ නව දේවල් ඉගෙනීමට උදව් කරනවා. මගේ මිතුරන් සමඟ කටයුතු කිරීම මට සමාජීය හැකියාවන් වර්ධනය කිරීමට සහ එකිනෙකාට ආධාර දීමට ඉගෙනීමට උපකාරී වේ. මම මිතුරන්ගේ සුහද ආචාර සහ ආදරය පිළිගනිමි. අපි එකට කතා කිරීම, සෙල්ලම් කිරීම සහ ගමන් යාමෙන් සතුට ලබා ගනිමු. මගේ මිතුරන් මට විශ්වාස සහ ආරක්ෂාව ලබා දෙන නිසා මම විවෘතව කතා කරමි. මිතුරන්ගේ සහය සහ ආදරය මගේ ජීවිතයට සතුට, සාමය සහ ආඩම්බරය ලබා දෙයි. මම මගේ හිතවත් මිතුරන්ට ආදරයෙන් සහ වගකීමෙන් හැසිරෙමි. ඔවුන් මගේ ජීවිතයට සතුට, ආරක්ෂාව සහ සමාජීය සම්බන්ධතා වර්ධනය කිරීමේ වැදගත්කම සපයයි. මගේ මිතුරන් මට සතුටින් ජීවත් වීමට සහ නව අත්දැකීම් ලබා ගැනීමට අවස්ථාව ලබා දෙයි.",FALSE,5,5,3,13
G6_009,6,මගේ පාසල් ගුරුවරු,"මගේ පාසල් ගුරුවරු කියන්නේ මට නව දේවල් ඉගෙනීමට සහ ජීවිතයේ වැදගත් පාඩම් ලබා ගැනීමට උපකාර කරන පුද්ගලයෝ වෙති. අපගේ ගුරුවරු අපට දැනුම ලබා දීමට, නව විෂයයන් පිළිබඳව පැහැදිලි කිරීම සහ අපිව විවෘතව විමසීමට සහ කතා කිරීමට අවස්ථාව ලබා දෙනවා. මගේ ගුරුවරුන් මට ගණිත, විද්‍යාව, භාෂා සහ කලා විෂයයන් සාර්ථකව ඉගෙනීමට උපකාර කරනවා. මම උදේ පාසලට යද්දී ගුරුවරුන්ගේ මෘදු ආචාර සහ ආශිර්වාද පිළිබඳව සතුට දැනෙයි. ගුරුවරුන් මට නව හැකියාවන් වර්ධනය කිරීමට, අභියෝග ජය ගැනීමට සහ නිර්මාණාත්මකව සිතුවිලි සැලැස්වීමට උපකාර කරනවා. මගේ ගුරුවරුන් මට යහපත් ආචාර, වගකීම් සහ සමාජීය හැකියාවන් ඉගැන්වීමට උපකාර කරන නිසා මම ඔවුන්ට ආදරය සහ ගෞරවයෙන් හැසිරෙමි. පාසල් ගුරුවරුන් මගේ ජීවිතයට ආශිර්වාද, දැනුම සහ සතුට ලබා දෙන මූලික පුද්ගලයෝ වේ. මම ඔවුන්ගේ උපදෙස් අනුව ජීවිතයේ සාර්ථක වීමට, සාමයෙන් සහ සතුටින් ජීවත් වීමට උත්සාහ කරනවා. මගේ ගුරුවරුන් මට ජීවිතයේ වැදගත් ආදර්ශයක් ලබා දෙන අතර මම ඒවා පිළිපැදීමෙන් සතුට සහ ජයග්‍රහණ ලබා ගනිමි.",FALSE,5,5,3,13
G6_010,6,අප අවට පරිසරය,"අප අවට පරිසරය අපගේ සෞඛ්‍යය කෙරෙහි දැඩි බලපෑමක් ඇති කරයි. අප අවට පරිසරයන් අපේ වට පිටවත් යහපත් නොවේ නම් අපට සෞඛ්‍යය සම්පන්න ජීවිතයක් ගත් කිරීමට නොහැකිය. අපේ වට පිටාව සෞඛ්‍යය සම්පන්න නොවුන හොත් දූෂිත පරිසරය නිසා අපට කොළරාව, කහ උණ, අජීර්ණ වැනි විවිධාකාර වූ රෝග වලට බඳුන් වනු ඇත.
අපේ නිවාස. අපේ ගෙවතු සහ මුළු මහත් පරිසරයම පිරිසිඳුව තබා ගැනිම අප විසින් කල යුතුව තිබේ. හිරු එළිය මිනිස් සිරුරට බෙහෙවින් වැදගත් වේ. එම නිසා අපේ නිවාස තුළට හිරු කිරණ වැටීමට ඉඩ සැලැස්වීම නො වැදගත්ය.
උදෑසන පිරිසිඳු වාතශ්‍රය ලබා ගත යුතුය. රාත්‍රියට අප නින්දට යන විට තද බවද ඇහැරුණු කාමර වලට වඩා සුව පහසු ඉඩ පහසුකම් සහිත කාමර වඩාත් සෞඛ්‍යය සම්පන්න වේ.
පිරිසිඳුභාවය සෑම අයෙකුටම අවැසිය. ගම්බද ජනතාව මේ මුලධර්මය පිලිබඳ එතරම් සිතන්නේ නැත. එසේ වුවද පිරිසිඳු වාතශ්‍රය ලැබීමේ වාසිය ඔවුනට නිසගයෙන්ම හිමි වේ.
නොව
අඛණ්ඩව කෙරෙන පරිසර දූෂණයෙන් යුතු නාගරික පෙදෙස් වල වෙසෙන අය මෙන් ගම්බද පරිසරයේ ජීවත් වන මිනිසුනට නිතරම පිරිසිදු වාතය, ජලය ලැබේ. නාගරික ප්රදේශ වල වාතයේ ඇති කබන්ඩයොක්සයිඩ් ප්‍රතිශතය ගම්බද ප්‍රදේශයේ වාතයට වඩා වැඩිය. මන්ද යත් නගරයේ ඇති තද බදයත් අධික ප්‍රමාණයකින් කර්මාන්ත ශාලා පිහිටා තිබිම හා වාහන භාවිතය අධික වීමත් නිසාය.
අප කොතැනක ජීවත් වුවද අප සැම විටම සැළකිලිමත් විය යුත්තේ අපගේ වට පිටාවන් පරිසරයත් පිළිබඳවය. අපට යහපත් සෞඛ්‍යය පිළිබඳ සැළකිලිමත් අසල් වැසි පිරිසක් සිටී නම් යහපත් නීරොගී සම්පන්න ජීවිතයක් ගත කිරීමට අපහසු නොවේ.
යහපත් සෞඛ්‍යයක් සඳහා අවට පරිසරය පිරිසිඳුව තබා ගැනීම කුඩා දරුවෙකු ලෙස අපට නිවසින් ආරම්භ කළ හැක. වතුර රැදෙන භාජන ඉවත් කර කාණු ශුද්ධ කර කුණු රොඩු පුලුස්සා නිස හා අවට පිරිසිඳුව තබා ගැනීමට අපට පුලුවන. එය පාසල, පන්සල දක්වා ව්‍යාප්ත කළ හැකි අතර ඒ සඳහා අපගේ මිතුරන්ද සහභාගි කරවා ගත හැක. එලෙස පිරිසිඳු පරිසරයක් තුලින් අපගේ සෞඛ්‍යය රැක ගැනීම අප අපටම කර ගන්නා ආශිර්වාදයකි.
",FALSE,5,5,2,12
