essay_id,grade,essay_topic,essay_text,dyslexic_flag,richness_5,organization_6,technical_3,total_14
G7_028,7,සෙල්ලම් කාලය,"පැවැත්මක් පිරුණු පාසල් දවසක පසු, සෙල්ලම් කාලය මට හොඳම විවේකය. මම සහ මගේ මිතුරන් හොඳම සෙල්ලම් බොල්ලෝ, ලුදුවීම, මල් ගොඩනැගීම වගේ ක්‍රියාකාරකම් කරමින් හිත නිදහස් කරගන්නවා.

සෙල්ලම් කරන වෙලාවේ මට ලැබෙන සෙනෙහස සහ සතුට—ඒක පාඩම් කරන වෙලාවේ උපරිම ශක්තියක්. සමහර දවසකට පාඩම් බර පුදුමාකාරයි. නමුත් මිතුරා එක්ක බෝලයක් රවුම් දෙකක් ගනින් ගියාම, හඬා හිනා වී මගේ බර අඩුවෙනවා.

අපේ ගුරුතුමියත් කියනවා—“සෙල්ලම් කියන්නේ දරුවෙකුගේ මනස නිහතමනී කරන ධෙයියක්” කියලා. මම ඒක හොඳ අර්ථයයි හිතනවා. සෙල්ලම් මඟින් මට ඉගෙනුම් හැකියාවත් වැඩි වෙනවා.

ගෙදර ආවම මම සෝපානයේ තාත්තාට සෙල්ලම් නියමයක් කියනවා. නංගීත් එක්ක බිඳු–බිඳු සෙල්ලම්. මේවා මගේ පවුලේ සෙනෙහස වැඩි කරනවා.

සෙල්ලම් කාලය කියන්නේ දරුවෙකුගේ හිත අලුත් කරන, ජීවිතය ලේසි කරන, බර අඩු කරන වටිනා කාලයකි.",FALSE,4,4,3,11
G7_029,7,ලියවිලි නිර්මාණය,"ලියවිලි නිර්මාණය මට ඉතාමත් ආසාවක්. මට කවි ලියන්නත්, කුඩා කතා හදන්නත්, වාර්තා ලියන්නත් හැමදාම ආසයි. කඩදාසි එකක් අරගෙන සිතුවිල්ලක් ලියන්න ගියම මගේ හිත පිරිසිදු වෙන්න පටන් ගන්නවා.

කවි ලියද්දී මම මිතුරු මල්, දැරියන්, සෙල්ලම්, පසලේ සෙවනැල්ල—මේවා ගැන සිතනවා. කවි පදක් මට හදවතින්ම එනවා. ගුරුතුමියත් මගේ කවි කියවලා “හොඳයි” කියනකොට මට ලැබෙන සතුට ඉස්සරහට ලියන්න ප්‍රේරණයක්.

වගාව, පරිසරය, සත්වයන් ගැන කතා හදනවා. ලියනකොට මගේ සිතේ දුක ද ඇහෙනවා, සතුටත් ඇහෙනවා.

ගෙදර දවසේ අවසන් වෙලා සුළඟක් ඇතිවෙද්දි ලියනකොට මට හිරු අස්සෙ වගේ සැනසීමක්.

ලියවිලි නිර්මාණය කියන්නේ මනස විවෘත කරන, සිතුවිලි වලට හැඩ යවන, දරුවෙකුගේ හැකියාව වර්ධනය කරන අතිශය වටිනා පුරුද්දක්.",FALSE,4,4,3,11
G7_030,7,මගේ සවිය — කිරි බත්,"කිරි බත් මගේ හොඳම කෑම. උදේම අම්මා කිරි බත් හදන සුවඳ මුහුදක් වගේම ගෙදර පුරා පාවෙයි. නලගේ ගසු සෙරෙව්වෙන් ඇවිත් බත් බල්ලා මත ලගාකරගෙන කෑම කාලාම මට ලැබෙන සැනසීම අවිස්සාවක්.

අම්මා පලමුව බත් හදන විදිහ බලනකොට මට එය හදන්නත් ඉගෙනගන්න වෙයි. කිරි බත් මත ලුණු කට්ටියක් දාපු විට එය තවමත් රසවත් වෙයි. කිරි බත් කියන්නේ නෙවෙයි, අම්මාගේ ආදරෙන් හදපු ආහාර.

තාත්තාත් කියනවා—“කිරි බත් නියමයි, මේකේ සුවඳ අමුතුයි” කියලා. විශේෂ දවස්වල අපි කිරි බත් අරගෙන වත්තෙ හිඳිනවා. ගොඩක් සුරූපී මොහොතක්.

මට කිරි බත් කියන්නේ සුවඳක්, රසයක්, පවුලේ සෙනෙහසක්. ඒක හදනකොට අම්මාගේ සිනහව මට හොඳම සැනසිල්ල. මම හිතනවා—කිරි බත් ජීවිතයේ ලැබෙන ලොකු සැනසුම් තෑග්ගකි.",FALSE,4,4,3,11
G7_031,7,ගුරුවරුන්ගේ උපදෙස්,"ගුරුවරුන් දරුවෙකුගේ ජීවිතයට ඔම් මගපෙන්වීමක්. ගුරුතුමිය අපට කියන උපදෙස්—“ගෞරවයෙන් හැසිරෙන්න”, “කාලය සුරකින්න”, “සමය හොඳින් භාවිතා කරන්න”—මේවා මට මේ දවසේ පමණක් නෙවෙයි, හෙට දවසෙත් කළමනාකරණය කරගන්න හොඳම මඟ.

ගුරුතුමිය කියන කතාවකින් මට ලැබෙන අදහස මොකක්ද කියලා මම හිතනවා. පරිසරය ගැන ඇය දෙන උපදෙස් මට හොඳම පාඩමක්. සත්ත්වයන්ට කරුණාව, මිතුවරුන්ට ගෞරවය, ගෙදර වගකීම්—මේවා අපිට දෙන්නෙත් ඒ ගුරුතුමියට.

උදේ පන්ති වලදී ඇය පෙන්වන නිවැරදි පුරුදු මට ගොඩක් වැදගත්. සමහර දවසෙ මට අමාරු පාඩම් තිබුනත්, ඇය ඒවා සරලව කියලා මට හොඳට තේරෙනවා.

මම හිතනවා—ගුරුවරුන්ගේ උපදෙස් අනුගමනය කරන දරුවෙකු ජීවිතයට සාර්ථකත්වය අරගෙන යනවා.",FALSE,4,4,3,11
G7_032,7,මගේ සිහින කේන්දරය,"මම දවසක් හූනං හොඳ සිසුවෙකු වෙලා රටටයුතුව දායාදයක් දෙන්න කැමති. මගේ සිහින මට අලුත් මගක්—මම අද කරන වැඩ හෙට රටට අවශ්‍ය.

පාසලේ මම හොඳින් ඉගෙන ගන්නවා, ගෙදර මිතුරන්ට උදව් කරනවා, පවුලේ සෙනෙහස සැටනවා. මගේ සිහින වල මාර්ගය—මෙකයි.

කවදාවත් මම තාත්තා වගේ නීතිඥයෙකු වෙන්නත්, වෛද්‍යයෙකු වෙන්නත් හිතනවා. නමුත් ගුරුවරුන් කියනවා—“ඕනෑම සිහිනයක් සැබෑ වෙන්නේ උත්සාහය තියෙන කොටයි.” මම ඒ වචන හදවතට ගන්නවා.

මගේ සිහින කේන්දරය මට අලුත් පණක්. මම හිතනවා—දරුවෙක් තමාගේ සිහින හදවතින්ම සුරකිනකොට, එය දවසක සැබෑ වෙනවා.",FALSE,4,4,3,11
G7_033,7,වගකීම්,"වගකීම් කියන දෙය දරුවෙකුගේ ජීවිතයේ අත්‍යවශ්‍ය කොටසක්. මම දවස පටන් ගත්තම වගකීම් ගැන හිතනවා. කාමරය පිරිසිදු කරනවා, බසය නිතර සුරකිනවා, අම්මාට උදව් කරනවා—මේ හැම දෙයක්ම වගකීමකි.

පාසලේ විද්‍යා ගුරුතුමිය කිව්වා—“වගකීම් තියෙන මිනිසෙකුට හෙට දවසේ හොඳ මඟ.” මට ඒක ලොකුම පාඩමක්. පන්ති වැඩ මම නිවැරදිව කරනවා. ගෙදරට ආවම පළමුව පාඩම් බලනවා.

වගකීම් තිබූවං දරුවෙකු කියන්නේ ජීවිතය හොඳටම හැදෙන කෙනෙක්. මම දැන් මගේ කාලය සුරකින්නත් ඉගෙන ගත්ත. දවසේ පළමුව කරන දේ, අවසානයේ කරන දේ—මේවා සැලසුම් කරලා කරාම දවස මනහර වෙනවා.

මම හිතනවා—වගකීම කියන්නේ අපිට ලැබෙන සෙරෙස් දායාදයක්.",FALSE,4,4,3,11
G7_034,7,පොත් කියවීම,"පොත් කියවීම මගේ හොඳම පුරුද්ද. කතාපොත්, කවි, ලිහිල් රසකතා—මෙවලින් මගේ හිත විවෘත වෙනවා. පොතක් අරගෙන ලඟ නඳුන් වෙලාවක සිටිනකොට මට දවස පුරා ලැබෙන තදබදය අඩු වෙනවා.

පාසලේ ගුරුතුමියත් කිව්වා—“පොත කියවන්නෙ මනස විවෘත කරන තාලයයි.” ඕක මට ඉතා වැදගත්. මම දවසකට වත් පේළි කිහිපයක් කියවන්න හදනවා. විවේක පන්තියේ වේලාවන්හිත් පොතක් ගෙන ඒවා කියවනවා.

ගෙදර තාත්තාත් මට පොත් කියවන්න උනන්දුවක් දෙනවා. සවස ගෙදරට ආවම මම කුඩා සොපනෙක බහිනවා, පොත අරගෙන කියවන්න පටන් ගන්නවා.

මම හිතනවා—පොත් කියවීමෙන් මට ලැබෙන්නේ කවි, චිත්‍ර, පරිසරය, සත්ත්වයන්, විද්‍යාව—සියල්ලම ලෝකයක්. එය මගේ සිතුවිලි උසස් කරනවා.",FALSE,4,4,3,11
G7_035,,දවසේ සැලැස්ම,"දවසෙ සැලැස්ම මට ජීවිතයේ සමනය. උදේ එකම කාලයට නගිලා ඉදිරියට වැඩ පටන් ගන්නවා. පළමුව දත් බ්‍රෂ් කරනවා, ඉන්පසු උයනට යනවා. අම්මා හදපු කිරි ගලා මට නිතරම පුදුම සැනසීමක්.

පාසලට යනකොට මගේ මිතුරන් හමුවෙනවා. ගුරුතුමිය කියන දේවල් සවිමත් පදනම. දවස පුරා මම සරලව ගෙන යනවා.

ගෙදර ආවම මම පළමුව පන්ති වැඩ බලනවා. ඉන්පසු අම්මාට උදව් කරනවා. සවසට මිතුරන් එක්ක පොඩි සෙල්ලම්. ඉරිදා දවසේ මම අලුත් ක්‍රියාකාරකම් කරනවා—වගාව, ලියවිලි, චිත්‍ර.

දවස අවසන් වෙද්දි මම හිතනවා—සැලසුමක් තියෙනකොට දවස ලස්සනයි. මගේ ජීවිතයත් සරලයි.",FALSE,4,4,3,11
G7_036,,ජීවිතයේ සතුට,"සතුට කියන්නේ අපේ හිතේ අහසේ තරම් වැදගත් දෙයක්. මට සතුට ගෙන එන්නේ මිතුරාගේ සිනහව, අම්මාගෙ කිරි බත්, වත්තේ කොළ පෙනෙන හැටි. ඔය හැමදේම මට සමුදුරක්.

අපේ ගුරුතුමිය කියනවා—“සතුට කියන්නේ බොහෝ ප්‍රමාණවත් දෙයක් නොවෙයි. පොඩි හොඳ දෙයක් බව.” ඒක මට වැදගත්. මම හිතනවා—පොඩිම දේවල් මට ලැබෙන සතුට ලොකු දෙයක්.

ගෙදර පවුලේ සුසුම, පාසලේ මිතුරන්ගේ හැසිරීම, සෙල්ලම් වෙලාවේ ලැබෙන හීන—මේයාල මට සතුටේ මූලික දායාද.

මම හිතනවා—දරුවෙකුට සතුට සේම වටිනා දේ නැත්තම් ජීවිතය හිස්. මම දවසින් දවස මගේ සතුට සුරකින්න හදනවා.",FALSE,4,4,3,11
G8_001,8,ජීවිතය සාර්ථක කරගැනීම,"ජීවිතය සාර්ථක කරගැනීම කියන්නේ පුරුදු දෙයක් නොවෙයි. එය මනස හදවාගෙන කරන ගමනක්. මම හිතනවා—සාර්ථක මිනිසෙකු වෙන්න අධිෂ්ඨානයත්, උත්සාහයත්, කාලය හොඳින් යොදාගන්නත් මනාකමට ඉගෙනගන්නත් අවශ්‍යයි.

දවස පටන් ගන්නා විටම මට මතක තියාගන්න එකක් තියෙනවා. ඒ තමයි දෙන දවස අගය කරන්න. පාසල් වැඩ, ගෙදර වැඩ, වගකීම්—මෙවැනි දේවල් මට සෙමෙන්ම පාලනය කරන්න වෙයි. සමහර දවස් ටිකක් බරපතලයි. නමුත් මම හිතනවා—කලු අහස තිබුණත් හිරු නැතිවෙලා නෑ කියලා.

ගුරුතුමිය කියනවා—“දරුවනේ, සාර්ථකත්වයට යන මාර්ගය දිගයි, නමුත් හරියටම ගියොත් පලය ලැබෙනවා” කියලා. ඒ වචන මට හොඳම දරුණු දවසකවත් මග පෙන්වීමක්.

අවසානයේ මම විශ්වාස කරනවා—සාර්ථකත්වය කියන්නේ ලොකු ලොකු ජයග්‍රහණ නොවෙයි. දවසින් දවස හොඳ මිනිසෙකු වෙන්න හදන උත්සාහයයි.",FALSE,4,4,2,10
G8_002,8,පවුලේ සබඳතාව,"පවුල කියන්නේ මිනිසෙකුගේ මුල් පාසල. මටත් තමන්ගේ පවුල සමඟ ගෙවන කාලය ගොඩාක්ම වැදගත්. අම්මා, තාත්තා, නංගි—සියලුම දෙනා එක්ක කතා කරනකොට, කෑම කන්නේ, සෙල්ලම් කරනකොට මට හිතේ වාතය නිකං වෙනවා.

අපේ පවුලේ හොඳම දේ තමයි එකිනෙකාට ගෞරවය. අම්මා අපට කියනවා—“කතා කරද්දී හදවතේ කාරුණික බව අඳුරන්න” කියලා. තාත්තා නම් අපට උගන්වන්නේ වැඩ කළ හැටි. මට කුඩා බර වැඩ තිබුණත්, මම එය ආතතියක් නොකර, පවුලට උදව් කරන විදිහට සිතන්න හදනවා.

සමහර රැයවල අපි එකතුව කතා කරනවා. දරුවන්ගේ පාසල් දෙවල්, තාත්තාගේ වැඩ පෙරළීම්, අම්මාගේ අළුත් අදහස්—මේ හැමදේම මගේ හිතේ විශේෂ තැනක් ගන්නවා.

පවුලේ එකමුතුව මිනිසාගෙ වැඩසටහන පිරිසිදු කරන අංගයක්. මම හිතනවා—පවුල හොඳින් තියෙන තැනකින් දරුවෙක් හොඳ මිනිසෙකු වෙලා ඉපදෙනවා.",FALSE,4,4,2,10
G8_003,8,මගේ පාසල,"මගේ පාසල මට හරිම විශේෂයි. එය ගම්මානයේ සුන්දර තැනක තියෙනවා. උදේ පාසලට යද්දී මම පාරෙන් යනකොට මල් ගස් වලින් වැටෙන සුවඳ මට හරිම සතුටක් දෙයි. පාසලේ විවිධ ගොඩනැඟීම් තියෙනවා—පරිපාලන ගෙදර, පුස්තකාලය, විද්‍යා ශාලාව, තරග ක්‍රීඩා බිම වගේ.

ගුරුවරුන් අපට සෙන්සුරුවටම ඉගන්වලා දෙනවා. සමහරවිට ඔවුන් අපට කාලය හරියට භාවිතා කරන්නොත් කියලම කතා කරනවා. මම දුටු විශේෂ දේ එකක් නම් මගේ පාසලේ හැමෝම එකට වැඩ කරන එක. පාසල පිරිසිදු කරන්න, ගස් පැල රොපන කරන්න, කලා දින සඳහා සූදානම් වෙන්න අපි හැමෝම එකතුවනවා.

මගේ හිතට ලඟම ඉන්නේ පුස්තකාලය. මට කතා නවාදම් පොත් කියවන්න හරිම ආසයි. කලාප කතාවක් කියවයි කියවයි මගේ අදහස් විහිදී යන්නේ දැනුම වැඩිවෙනවා වගේ. එක තමයි මට පාසල් ජීවිතේ ලැබෙන ලොකු ප්‍රතිලාභයක්.

පොදුවේ, මගේ පාසල මට මතක සටහන් බොහොමයක් දෙන තැනක්. නිතරම මට සිතෙනවා—මෙතරම් හොඳ පාසලක් හිමිවීම මට ලැබුණු වරමක් කියලා.",FALSE,4,4,2,10
G8_004,8,මාගේ විනෝදාංශය,"චිත්‍ර අඳින්න කවදාවත් මට අමාරු දෙයක් වුනේ නැතිව. කුඩා දවස් වල සිටම මම පැන්සිල් එකක් අරගෙන දමා කිරිල්ලෙක් වගේ සෙල්ලම් කරලා අඳිනවා. මගේ අම්මාත් කියනවා කුඩා කලේ දාන බිත්තියේ ලකුනු දැන්වත් අමතක නැහැ කියලා.

මම පාසලට යනවිටත් ඉතින් චිත්‍ර ශිල්පය මගේ ප්‍රියතම පාඩමක්. ගුරුවරු කිව්ව හැම විටම මට අදහස් තියෙනවා, මම නවින්‍යමය හැඩ රටා, ලස්සනවූ තැන ඉගෙන ගන්නත් හිතෙනවා. මට විශේෂයෙන් වැඩිපුර අඳින්න ඕන අයිතම නම් කාලගුණ දල්වී ඇති දර්ශන. වර්ෂාව තියෙන දවසක්, දවල් පහන් වී ඇති මල් ගෙදර, හෝ ගස් යටින් පාසැල් ළමයි හිනාවෙන දර්ශන මට හොද ඉඟි.

චිත්‍ර අඳිනකොට මානසික සන්සුන් බවක් ලැබෙනවා. පාසල් වැඩවල තියෙන තාක්ෂල් බර බලන්නෙත් අඩුයි. පසුව මම හිතනවා සම්පූර්ණ ශිල්පකරු බවට පත්වෙන්න. ඒත් ඒකට මැදිරිම මට තව දුරටත් ‍උත්සාහය තියාගන්න ඕන.",FALSE,4,4,2,10
G8_005,8,ගෙදර කාලය භාවිතා කිරීම,"පාසලෙන් ගෙදර එනකොට මම සෙල්ලම් කරන්න හිතෙනවා. හැබැයි මගේ තාත්තා කියනවා “මුලින්ම පාඩම් කරලා ඉවර කරගන්න” කියලා. ඒ නිසා මම කොච්චරම අමාරුවුනත් හෝ නිර්දේශ කරන ප්‍රථම වැදගත්කම පාඩම්ට දෙනවා.

ගෙදර කාලය හරියට භාවිතා කිරීම ගැන ගුරුවරුන් කියනවා. මමත් ඒක අසා පුරුදු කරගන්න උත්සාහ කරනවා. සමහර දවස් හික්මවී ගිහිල්ලා ටෙලිවිෂන් බලනවට වැඩිපුර කාලයක් යනවා. ඒක හොඳ නැහැ කියලා අම්මා කිව්වට පස්සේ මම දවසේ වැඩ ලැයිස්තුවක් කරගත්තා. ඒ කියන්නේ පාඩම්, ව්‍යායාම, විවේකය හා සෙල්ලම් කාලය.

මෙහෙම කළාම මට වැඩේවත් දිනපතා පිරිසිදුයි. ගෙදර වැඩ උදාහරණයක් විදිහට බත් පිසීම, වතුර ගෙන එන්න, බඩු ගලවා දාන්න වගේ දේවල් මම උදව් කරනවා. මේකෙන් මට වැදගත් දෙයක් කියලා හිතෙනවා—කවුද කාලය හරියට භාවිතා කරන්නේ නැත්තම් ඔහුගේ ජීවිතය ගැඹුරටම අහිමි වෙනවා.",FALSE,4,3,2,9
G8_006,8,සතුන්ට කරුණාව,"සතුන්ට කරුණාව දක්වන්න ඉගන්වන්නෙ අපේ ගුරුවරුන් පමණක් නෙවෙයි, අපේ අම්මා තාත්තාත්. මම පුටුවක් ඉඳගෙන වවුලා, කුරුල්ලෝ, බිළිහුන්, බල්ලෝ—අපේ ගෙදරට එන සත්ත්වයන් ගැන හිතනවා. ඒවාත් අපේ වගේම ජීවිතයක් තියෙනවා කියලා මට දැනෙනවා.

මිණිපොත් කීප් පනින්න ඕන තරමට කබලන් හෝ අහසෙ එන කුරුල්ලන්ට කිරි සීනි ටිකක් දාලා තරිදු කඩල දෙනවා. සමහර වෙලාවට මගේ නංගිත් මේ වැඩෙට ලවා හෙලුවෙන් සතුටෙනම තැවුල මැදට ගණන් කරලා දෙනවා.

ගෙදර බලුවෙක් තියෙන නිසා මම ඔහුට බෙහෙවැට ආහාර දෙනවා. සමහර දවසවල ඔහු අසනීප වෙනවා. ඒකට මම බය වෙනවා. තාත්තා ඔහුට ඖෂධය ගෙන දෙනකොට මම හිතනවා—සතුන් එවකට මොනතරම් භයානක අයුබෝවන් ගැන තමයි.

සතුන්ට කරුණාව කියන්නේ පිරිසිදු මනුකමක්. ඒක අපි හොඳම හිතකින් භාවිත කරන්න ඕනේ.",FALSE,3,3,2,8
